{
  "adr_refs": [],
  "affected_components": [
    "backend-api"
  ],
  "affected_contracts": [],
  "behavioral_effects": [
    "make dev-codecov succeeds from any shell once the CODECOV_* block is in a root .env, independent of when the shell or its parent application was started"
  ],
  "compatibility_impact": "None for prod (prod-codecov unchanged, still backend/.env). dev-codecov gains a second credential source; shell exports still work and still take precedence. No compose, image, port, or contract change.",
  "date": "2026-08-17",
  "files_changed": [
    "MANUAL_STEPS.md",
    "Makefile",
    "backend/.env.example"
  ],
  "follow_up": [],
  "id": "2026-08-17-let-dev-codecov-read-credentials-from-the-root-env-that-compose",
  "initiated_by": {
    "kind": "agent"
  },
  "limitations": [
    "The root .env is Compose's global interpolation source, so any other interpolated variable placed there (POSTGRES_PASSWORD, MINIO_ROOT_USER, DOMAIN) applies to the whole dev stack; the docs say to copy only the CODECOV_* block, but nothing enforces that",
    "The proof of the full boot from .env alone stopped at the pre-existing-volume password mismatch, which is expected behaviour rather than a defect; the guard-and-interpolation half is proven, the fresh-volume boot from .env alone was proven in the original session with equivalent values"
  ],
  "manifests_changed": [],
  "reason": "make dev-codecov guards its credentials by inspecting the shell environment only, while Docker Compose interpolates the same variables from a root .env automatically; an operator who puts the CODECOV_* values in .env or the Windows registry still hits the placeholder guard from any shell that predates the change, so the guard rejects a configuration Compose would happily use � pointing the dev-codecov guard at .env makes the file Compose reads and the file the guard reads the same file",
  "risks": [],
  "rollback": "git revert. Nothing outside the repository is affected; an operator's root .env is theirs and is not created or removed by this change.",
  "schema_version": 1,
  "security_impact": "Reduces secret sprawl: dev credentials can live in a single gitignored root .env instead of shell exports or Windows user-scope environment variables. The root .env matches the existing top-level .gitignore rule (verified with git check-ignore); no secret values are recorded or committed. Guard precedence (process env, then file) equals Compose's own precedence, so the guard can neither pass on a value Compose would ignore nor reject one Compose would use.",
  "summary": "Let dev-codecov read credentials from the root .env that Compose already interpolates",
  "tool_version": "1.0.0",
  "validators_run": [
    {
      "id": "compose-check",
      "result": "pass"
    },
    {
      "id": "preflight-volumes",
      "result": "pass"
    },
    {
      "evidence_ref": "22 pre-existing ty diagnostics, unchanged",
      "id": "backend-lint",
      "result": "pass"
    },
    {
      "evidence_ref": "505 passed, 13 skipped",
      "id": "backend-unit",
      "result": "pass"
    },
    {
      "evidence_ref": "29 tests",
      "id": "frontend-test",
      "result": "pass"
    },
    {
      "evidence_ref": "4 skipped, no host-reachable database; no schema change",
      "id": "migrations",
      "result": "pass"
    },
    {
      "evidence_ref": "benign — dev stack running; governance-check-fast used as baseline (14 checks, 0 blocking, 0 advisory)",
      "id": "preflight-ports",
      "result": "fail"
    },
    {
      "evidence_ref": "in a shell holding none of the CODECOV_* variables, preflight-codecov with CODECOV_ENV_FILE=.env refused when .env was absent, refused when .env held a change-me placeholder, and passed with real values (quoted and unquoted); make dev-codecov then reached the Compose boot phase and the postgres container's environment carried the .env value, proving Compose and the guard now read the same file",
      "id": "guard-proof",
      "result": "pass"
    },
    {
      "evidence_ref": "the operator's existing codecov stack (volumes initialised at 20:35Z with their own credentials, 77 tables) was recreated by the proof run with scratch values and failed on password authentication as the documented volume caveat predicts; restored with the operator's values via process env — all 8 containers healthy, gateway_health 26.4.1, login redirect carries the operator's real OAuth client id; scratch .env deleted",
      "id": "live-restore",
      "result": "pass"
    }
  ]
}
