{
  "adr_refs": [],
  "affected_components": [
    "agent-operating-surface"
  ],
  "affected_contracts": [],
  "behavioral_effects": [
    "Capability-gap questions now trigger template-upgrade, which checks the generator's unselected options with upgrade-dry-run before a from-scratch build is sized"
  ],
  "compatibility_impact": "None - no interface, schema, or contract changes",
  "date": "2026-10-23",
  "files_changed": [
    ".claude/skills/template-upgrade/SKILL.md"
  ],
  "follow_up": [],
  "id": "2026-10-23-install-the-reviewed-template-upgrade-update-check-the-generator",
  "initiated_by": {
    "kind": "agent"
  },
  "limitations": [
    "Shrink pass ran in its inline form (documentation-only diff): nothing removed, because the file is a reviewed staged copy installed byte-for-byte so the review bookkeeping can match it; every added rule traces to an ACTIONED observation in the archived task-observer log"
  ],
  "manifests_changed": [],
  "reason": "The live template-upgrade skill had not changed since 2026-08-10 and triggered only for upgrades, so a capability assessment concluded a feature would have to be built from scratch when the template generator offers it as an option this project was not generated with; the generated tree cannot reveal unselected options (observation 8). The 2026-08-30 review staged a trigger for that case; installing it sends capability questions to upgrade-dry-run with new features before any build is sized.",
  "risks": [],
  "rollback": "git revert restores the previous skill text. The staged source copy stays outside the repository at ~/.claude/skill-updates/2026-08-30/template-upgrade and is not touched by a revert",
  "schema_version": 1,
  "security_impact": "None - agent-facing skill text only; no runtime code, configuration, or permission changes",
  "summary": "Install the reviewed template-upgrade update: check the generator's unselected options before sizing a build",
  "tool_version": "1.0.0",
  "validators_run": [
    {
      "evidence_ref": "53 files scanned, every citation resolves",
      "id": "skills-check",
      "result": "pass"
    },
    {
      "evidence_ref": "44 checks, 0 blocking, 8 advisory, all pre-existing",
      "id": "governance-check",
      "result": "pass"
    }
  ]
}
